{"$schema":"https://json-schema.org/draft/2020-12/schema","$id":"https://abvx.invalid/schemas/book-radar-similarity-fixture/v1","title":"Book Radar Portfolio Similarity Fixture","type":"object","additionalProperties":false,"required":["schema_version","id","candidate","existing_product","weights","facets","expected"],"properties":{"schema_version":{"const":"book-radar-similarity-fixture/v1"},"id":{"type":"string","minLength":1},"candidate":{"type":"object"},"existing_product":{"type":"object"},"weights":{"type":"object"},"facets":{"type":"object"},"expected":{"type":"object"}}}
